{"draft_id":"11111111-1111-4111-8111-111111111111","mapping_id":"gen-data-canonical-observation","target_version":"v2","base_version":"v1","revision":1,"status":"draft","payload":{},"payload_sha256":"1111111111111111111111111111111111111111111111111111111111111111","validation_status":"not_validated","validation_errors":[],"validated_revision":null,"created_by":"system-operator","updated_by":"system-operator","created_at":"2026-09-01T00:00:00Z","updated_at":"2026-09-01T00:00:00Z","published_at":null,"published_sha256":null,"publish_error_code":null,"publish_error_message":null}
